Topic,Top_10_Features
0,patriot always stand espn football year fan blog nflnews texansã
1,office rumble oversee blindly someone front offseason fly drive bus
2,astro go weekend follow fit donã seem feel sensible base
3,coach sort try give really maintain follow plan sensible fickleness
4,game letter fan everythingsport start give hold need end bargain
5,get mmqb trade want houstonã deal saturday beg question slew
6,blog decision plan era worth even post backã scenario room
7,trading still away left quite franchise direction whatã askingã offensive
8,trade lack frantic direction vision texansã franchiseã seismic player breaking
9,week start seasonã check letã head coachgm cornerback know want
